Tweet,Borough,Hate Prediction,Tweet Date,Latitude,Longitude
Hindu terrorists free torture poor Muslims India,Sutton,religion,2022-12-04 10:45:17+00:00,51.357464449999995,-0.17362689496950337
other cricket commentators indulge dopey girly inane nonsense unreal Does have something commissioning editors,London,sexism,2022-12-04 10:20:15+00:00,51.5073359,-0.12765
Agreed Fossil fuelled terrorists should arrested sent Hague wrong govt does have power British corporations investing climate genocide Just like banned them investing slavery declining zero 2030 disaster results,City of London,racism,2022-12-04 10:13:57+00:00,51.5156177,-0.0919983
Thanks Mencap Campaigns Team letting this little lady crash your party,Brent,sexism,2022-12-04 10:07:28+00:00,51.5639957,-0.27590641378489267
Root genius bats left handed stress mere mortal struggles write name left handed,Wandsworth,disability,2022-12-04 09:55:00+00:00,51.4570271,-0.1932607
Feminists aren reducing women anything just categorising describing ourselves what have common,Richmond,sexism,2022-12-04 09:07:31+00:00,51.4613531,-0.3032767
Does race baiting well Femi,Harrow,sexism,2022-12-04 07:44:33+00:00,51.596827149999996,-0.3373046180437286
Think name wrong Femi,Richmond,sexism,2022-12-04 07:34:58+00:00,51.4613531,-0.3032767
Nigeria political leaders criminals country where politicians hoarded public money palliative food items monkeys snakes swallowed public funds investigation done ascertain facts then jailed monkeys snakes human form shameful,Lewisham,racism,2022-12-04 07:26:42+00:00,51.4624292,-0.0101787
prize bitch heat then just might fours impregnate properly will need fully examine first starting with your magnificent breasts suckable,Hackney,sexism,2022-12-04 06:58:16+00:00,51.5432402,-0.0493621
Obviously haven learnt there lesson when advised when women dark walking their approach intimidating,Merton,sexism,2022-12-04 06:51:54+00:00,51.41086985,-0.18809708858824303
girls doing eyeshadow Nahh times have changed,Camberwell,sexism,2022-12-03 23:20:53+00:00,51.4745706,-0.0925416
drunk again surprised really clown,Enfield,disability,2022-12-03 22:40:29+00:00,51.6520851,-0.0810175
clear gutters cunt,Merton,sexism,2022-12-03 22:03:06+00:00,51.41086985,-0.18809708858824303
that china treating humans their rights within unalienable rights must pray brothers sisters caught corporation nation crime oppression dictators,Harrow,racism,2022-12-03 21:46:59+00:00,51.596827149999996,-0.3373046180437286
still letting these slavemasters take your money,Barnet,racism,2022-12-03 20:13:39+00:00,51.65309,-0.2002261
professional mean entitled middle class,Camden Town,disability,2022-12-03 19:30:10+00:00,51.5423045,-0.1395604
What cunt,Merton,sexism,2022-12-03 19:21:48+00:00,51.41086985,-0.18809708858824303
Akon cunt,Hillingdon,sexism,2022-12-03 18:23:53+00:00,51.542519299999995,-0.44833493117949663
lightweight proper mentor happy help least rubber duck,Kensington,disability,2022-12-03 17:19:00+00:00,51.4989948,-0.1991229
Normalize fucking anti semites,Paddington,religion,2022-12-03 15:46:19+00:00,51.5154795,-0.175365
Also Chantal Ackerman feminist director,Croydon,sexism,2022-12-03 14:10:18+00:00,51.3713049,-0.101957
need women game please make happen next season,Hackney,sexism,2022-12-03 13:15:56+00:00,51.5432402,-0.0493621
There must loads devastatingly good looking female cricket football loving faux grumpy misanthropes Manchester area surely,Hackney,sexism,2022-12-03 13:03:03+00:00,51.5432402,-0.0493621
female friends disliking partner different from male friends disliking partner guys,Lambeth,sexism,2022-12-03 12:41:18+00:00,51.4952111,-0.1163354
shut idiot,Barking,disability,2022-12-03 12:34:58+00:00,51.5389922,0.0804245
ever this traitor turned replies feminist,Camden Town,sexism,2022-12-03 12:21:45+00:00,51.5423045,-0.1395604
Such twat,Lewisham,sexism,2022-12-03 11:38:28+00:00,51.4624292,-0.0101787
Lady should have stopped giving away Truly would wear bones your neck European dress couldn tell straight away where your family originally come from That what Lady curious about knew,Kensington,sexism,2022-12-03 10:18:25+00:00,51.4989948,-0.1991229
embarrassing yourself full retard,Lambeth,disability,2022-12-03 10:04:15+00:00,51.4952111,-0.1163354
stop until whole world will discover pumping money Kagame exterminate subhumans Democratic republic Congo,Romford,racism,2022-12-03 08:06:04+00:00,51.5760462,0.1822646
female dogs called bitches,Camden Town,sexism,2022-12-03 07:46:22+00:00,51.5423045,-0.1395604
Women evil,Richmond,sexism,2022-12-03 07:44:27+00:00,51.4613531,-0.3032767
Feminism MGTOW mostly post wall women complaining they find good Anti social dudes guys that like marriage laws Result birth rate decline,Islington,sexism,2022-12-03 05:00:21+00:00,51.5384287,-0.0999051
STICKY STICKY STICKY hope snitches separately bitch,Islington,sexism,2022-12-03 02:14:56+00:00,51.5384287,-0.0999051
speak imperial going with 169cm,Camden Town,disability,2022-12-03 00:53:29+00:00,51.5423045,-0.1395604
Take your eagle shove your arse shiptar scum,London,religion,2022-12-02 23:23:42+00:00,51.5073359,-0.12765
Thread Pakistani dinosaur wannabe intellectual power syndrome Desperate become story himself feel pity such shallow personalities rude Serve idiot yourself,Kingston upon Thames,disability,2022-12-02 21:42:58+00:00,51.4096275,-0.3062621
sorry these most sickening evil satanic worrying images have seen very long time these sick freaks really heading into dark ages,Romford,religion,2022-12-02 21:37:51+00:00,51.5760462,0.1822646
extremely stupid,Camden Town,disability,2022-12-02 21:35:29+00:00,51.5423045,-0.1395604
cowardly Zionist terrorist soldier deals with armed Palestinian Snow flake Zionists would terrorist Palestinian soldier this unarmed Zionist racist invader,Bromley,religion,2022-12-02 21:28:04+00:00,51.4028046,0.0148142
agree with kids well think been diagnosed school life would different would gone university told thick stupid should just pregnant popped kids stupid educated,Camberwell,disability,2022-12-02 21:27:59+00:00,51.4745706,-0.0925416
influenced twats with control point sharper,Brent,sexism,2022-12-02 20:29:06+00:00,51.5639957,-0.27590641378489267
stubborn twat,Ealing,sexism,2022-12-02 20:22:32+00:00,51.5126553,-0.3051952
Nahh dont talk women first,Kingston upon Thames,sexism,2022-12-02 20:21:09+00:00,51.4096275,-0.3062621
Join cycling club male,Islington,sexism,2022-12-02 19:41:12+00:00,51.5384287,-0.0999051
half clever thinks,Richmond,disability,2022-12-02 18:32:42+00:00,51.4613531,-0.3032767
What load twats hitting always losing plot when doesn there,Hillingdon,sexism,2022-12-02 17:05:36+00:00,51.542519299999995,-0.44833493117949663
year Lady should feel Ashamed,Hounslow,sexism,2022-12-02 17:00:07+00:00,51.4686132,-0.3613471
Ayew dumb bruv,Harrow,disability,2022-12-02 15:22:31+00:00,51.596827149999996,-0.3373046180437286
also fancy years opposition think idiot Tory Wall,Brent,disability,2022-12-02 14:40:58+00:00,51.5639957,-0.27590641378489267
Maybe should issuing chastity belts male,Brent,sexism,2022-12-02 14:38:32+00:00,51.5639957,-0.27590641378489267
girls smart,Islington,sexism,2022-12-02 14:02:07+00:00,51.5384287,-0.0999051
priority tickets cunt,Hackney,sexism,2022-12-02 13:26:47+00:00,51.5432402,-0.0493621
type voice message send other half really make quite giddy worth idiot factor,Poplar,disability,2022-12-02 13:09:39+00:00,51.5110713,-0.0144629
upon worthless weak fucks Make happy make smile fulfill that faggot purpose yours then subscribe,London,sexual_orientation,2022-12-02 12:52:02+00:00,51.5073359,-0.12765
surprise please stop making assumptions others intent just makes moron also very wrong,Enfield,disability,2022-12-02 11:30:37+00:00,51.6520851,-0.0810175
like woman Wobbles Tesco Shepherd Bush would make feel really uncomfortable went,Camden Town,sexism,2022-12-02 11:27:40+00:00,51.5423045,-0.1395604
business streets should punch this nigga,Paddington,racism,2022-12-02 11:26:42+00:00,51.5154795,-0.175365
Utterly disgusting Woman,Bromley,sexism,2022-12-02 10:44:06+00:00,51.4028046,0.0148142
Racist sexist gave mandate figure Country crashing this lady vilified What about price energy,Paddington,sexism,2022-12-02 10:37:22+00:00,51.5154795,-0.175365
twat that posted vile blocked already deal,Camberwell,sexism,2022-12-02 09:03:43+00:00,51.4745706,-0.0925416
such clown real dumb dumb Brandon,Islington,disability,2022-12-02 08:47:47+00:00,51.5384287,-0.0999051
think point have them Would female version Stephen Graham included excluded,Enfield,sexism,2022-12-02 08:19:23+00:00,51.6520851,-0.0810175
Keeping such creatures captivity should banned perpetrators locked mental institutions cure their state mind,Islington,religion,2022-12-02 04:13:34+00:00,51.5384287,-0.0999051
average woman,Camden Town,sexism,2022-12-02 03:53:33+00:00,51.5423045,-0.1395604
really hate niggas,Barnet,racism,2022-12-02 01:02:36+00:00,51.65309,-0.2002261
Margaret thatcher riiiight cunt,Harrow,sexism,2022-12-02 00:10:42+00:00,51.596827149999996,-0.3373046180437286
Well certainly wrong That sissy just breathtaking ever opportunity visit Melbourne hitting without doubt,London,sexism,2022-12-01 23:52:46+00:00,51.5073359,-0.12765
Some your Spotify wraps giving basic bitch really should your eyes only,Wandsworth,sexism,2022-12-01 23:39:59+00:00,51.4570271,-0.1932607
twat with pony tail wearing black vent mask Unbelievable probably jabbed,Camberwell,sexism,2022-12-01 22:45:16+00:00,51.4745706,-0.0925416
When argument against your girl talking,Hackney,sexism,2022-12-01 22:31:50+00:00,51.5432402,-0.0493621
arrogant little bitch none weaklings space have balls call Essentially trading cred,Camberwell,sexism,2022-12-01 22:29:48+00:00,51.4745706,-0.0925416
twat bloody hell,Hounslow,sexism,2022-12-01 22:08:06+00:00,51.4686132,-0.3613471
call faggot leprechaun WILL listening,Wandsworth,sexual_orientation,2022-12-01 22:01:33+00:00,51.4570271,-0.1932607
when going girls school,Camden Town,sexism,2022-12-01 21:49:20+00:00,51.5423045,-0.1395604
Essex wonderful female owned petrol station,Bromley,sexism,2022-12-01 21:47:39+00:00,51.4028046,0.0148142
mean really fucking dull okay,Bromley,disability,2022-12-01 21:26:42+00:00,51.4028046,0.0148142
Thank such terrible heathen sadly love folderololl church have ZERO knowledge Happy Christmas,Paddington,religion,2022-12-01 21:13:09+00:00,51.5154795,-0.175365
ONLY Have word WHAT SAID thats very dubious woman agenda,Kingston upon Thames,sexism,2022-12-01 21:05:40+00:00,51.4096275,-0.3062621
take Bart head mongrel head,Hillingdon,disability,2022-12-01 19:43:38+00:00,51.542519299999995,-0.44833493117949663
Nice also female refereed World football game,Hillingdon,sexism,2022-12-01 19:29:13+00:00,51.542519299999995,-0.44833493117949663
Twat,Bromley,sexism,2022-12-01 19:17:00+00:00,51.4028046,0.0148142
Fuck cunt,Hackney,sexism,2022-12-01 19:12:58+00:00,51.5432402,-0.0493621
girl queue Holly Humberstone with cool fuck,Lambeth,sexism,2022-12-01 19:05:07+00:00,51.4952111,-0.1163354
down moderate small prick,Camden Town,disability,2022-12-01 18:54:34+00:00,51.5423045,-0.1395604
stand that cunt,Hillingdon,sexism,2022-12-01 18:24:17+00:00,51.542519299999995,-0.44833493117949663
woman always been complete fucking idiot then good know,Hammersmith,sexism,2022-12-01 18:19:02+00:00,51.4920377,-0.2236401
This kinda Lady cannot settle working class young This established things being equal will lavish money render impossible with someone that match spending power,Croydon,sexism,2022-12-01 17:11:53+00:00,51.3713049,-0.101957
Probably because time your seat difficult change situation like fully booked flights feel like this probably also happens mostly women,Paddington,sexism,2022-12-01 16:15:36+00:00,51.5154795,-0.175365
Internet Occultists Lying minutes stop ultra reactionary pagan dogwhistling kids aren alright,Greenwich,religion,2022-12-01 16:03:06+00:00,51.4820845,-0.0045417
away idiot,Romford,disability,2022-12-01 16:02:03+00:00,51.5760462,0.1822646
Love female workplace ones,Wandsworth,sexism,2022-12-01 14:10:04+00:00,51.4570271,-0.1932607
fucking idiot,Romford,disability,2022-12-01 13:15:03+00:00,51.5760462,0.1822646
Look much loves club wanna cunt give stick when goes,Romford,sexism,2022-12-01 13:14:39+00:00,51.5760462,0.1822646
said fuck cunt Fuck cunt,Paddington,sexism,2022-12-01 12:36:06+00:00,51.5154795,-0.175365
have idiot dangerous both huge,Kensington,disability,2022-12-01 11:56:48+00:00,51.4989948,-0.1991229
generation fools socially leading imbeciles,Greenwich,disability,2022-12-01 11:54:04+00:00,51.4820845,-0.0045417
Unbelievable cunt then play victim,Poplar,sexism,2022-12-01 11:46:25+00:00,51.5110713,-0.0144629
Heroes That deal with these cunts,Hillingdon,sexism,2022-12-01 11:05:13+00:00,51.542519299999995,-0.44833493117949663
have spoken aware DILF status mind rest about situation responded with must have been hammered there will some sore heads this morning,Lambeth,sexism,2022-12-01 10:40:48+00:00,51.4952111,-0.1163354
That journalists stuffed with stuff gender stuff didn What wally Good answers from girls,Poplar,sexism,2022-12-01 10:39:51+00:00,51.5110713,-0.0144629
Exactly never bother lady brain with anything else,Hackney,sexism,2022-12-01 10:34:00+00:00,51.5432402,-0.0493621
confirmed basic bitch,Hackney,sexism,2022-12-01 09:48:31+00:00,51.5432402,-0.0493621
should jettisoned presidential position order First Lady Seriously,Paddington,sexism,2022-12-01 09:22:32+00:00,51.5154795,-0.175365
This disgusting Time stop pleasing other religions case offends them,Romford,religion,2022-12-01 09:21:16+00:00,51.5760462,0.1822646
Next lesbians will explain they women pregnant Back London Turkey basters with sperm harvested from their male friends apparently,Islington,sexism,2022-12-01 09:18:29+00:00,51.5384287,-0.0999051
never niggas assure,Hounslow,racism,2022-12-01 08:59:11+00:00,51.4686132,-0.3613471
hear Escape Victory rebooted using female footballers like crossed with Tenko,Romford,sexism,2022-12-01 07:50:51+00:00,51.5760462,0.1822646
scumbag maggot cheap lousy faggot December legally discuss Christmas argue about everyone imaginary your head turns points when this song comes,Kingston upon Thames,sexual_orientation,2022-12-01 07:48:07+00:00,51.4096275,-0.3062621
female politicians,Greenwich,sexism,2022-12-01 07:32:01+00:00,51.4820845,-0.0045417
Chucky disgusting word silly pussy,Richmond,sexism,2022-12-01 07:28:43+00:00,51.4613531,-0.3032767
germany worse holocaust worst genocide history deny this freak nature,Bexley,religion,2022-12-01 07:05:14+00:00,51.4416793,0.150488
delusional idiot think this,Richmond,disability,2022-12-01 05:20:08+00:00,51.4613531,-0.3032767
young rich stupid,Barnet,disability,2022-12-01 04:44:21+00:00,51.65309,-0.2002261
Time keep your xenophobic mouth zipped,Camden Town,racism,2022-12-01 02:03:16+00:00,51.5423045,-0.1395604
fuckidy fuck going niggas,Poplar,racism,2022-12-01 01:09:58+00:00,51.5110713,-0.0144629
Humble Aint Bitch Inna When Test MENTAL Ward Send,Walthamstow,sexism,2022-12-24 20:12:12+00:00,51.5844701,-0.0188186
Muslim countries running immoral education somehow Taliban enlighten with version Islam none know,Walthamstow,religion,2022-12-24 19:52:28+00:00,51.5844701,-0.0188186
Never trust women,Tottenham,sexism,2022-12-24 19:44:28+00:00,51.5976955,-0.0672892
only colonial robbery going your genocide Ukraine,Tottenham,racism,2022-12-24 14:01:35+00:00,51.5976955,-0.0672892
People organise participate illegal hunting indeed they still most despicable uncaring cruel humans Animals just equipment they they gallop wrecking nature murdering foxes mistreat kill abandon dogs horses,Tottenham,religion,2022-12-24 09:32:40+00:00,51.5976955,-0.0672892
fuck this cunt,Ilford,sexism,2022-12-23 23:56:29+00:00,51.5582734,0.0711669
would have blindfolded little cunt thrown boot dropped somewhere very isolated populated bears,Tottenham,sexism,2022-12-23 20:20:20+00:00,51.5976955,-0.0672892
Well done understand draining most females would rather that almost everyone under shit immune system today,Ilford,sexism,2022-12-23 15:34:12+00:00,51.5582734,0.0711669
short hair gives away clueless,Ilford,disability,2022-12-23 13:02:09+00:00,51.5582734,0.0711669
women still breast feed babies anymore that,Ilford,sexism,2022-12-23 12:04:46+00:00,51.5582734,0.0711669
This make sense must always work because girls prefer their dads mums usually,Ilford,sexism,2022-12-23 10:35:45+00:00,51.5582734,0.0711669
second your obvs illiterate,Walthamstow,disability,2022-12-23 08:25:24+00:00,51.5844701,-0.0188186
autism stupid,Stratford,disability,2022-12-22 14:10:18+00:00,51.541289,-0.0035472
They shouldn rising cunts,Walthamstow,sexism,2022-12-22 12:25:33+00:00,51.5844701,-0.0188186
never play obviously genius,Walthamstow,disability,2022-12-22 08:37:07+00:00,51.5844701,-0.0188186
Just took look comments regarding winner SPOTY Blimey Pick crop saying female should ever this award ever,Ilford,sexism,2022-12-22 08:26:23+00:00,51.5582734,0.0711669
that should list femi shola ngozi should they should running this country right behind them,Tottenham,sexism,2022-12-22 07:15:53+00:00,51.5976955,-0.0672892
Niggas want want that gonna death,Stratford,racism,2022-12-21 23:33:06+00:00,51.541289,-0.0035472
almost like woman then,Tottenham,sexism,2022-12-21 20:41:58+00:00,51.5976955,-0.0672892
such fake bitch,Tottenham,sexism,2022-12-20 20:35:58+00:00,51.5976955,-0.0672892
know naive,Tottenham,disability,2022-12-20 11:53:07+00:00,51.5976955,-0.0672892
your Neanderthal genes making write like some sort retard fuck Nature nurture whatever someone something fucked time upbringing here,Walthamstow,disability,2022-12-19 23:49:32+00:00,51.5844701,-0.0188186
keeping slave traders their plinths this spot view Sorry Gary,Tottenham,racism,2022-12-19 21:06:35+00:00,51.5976955,-0.0672892
Dash Feminine Pepper,Tottenham,sexism,2022-12-18 19:51:48+00:00,51.5976955,-0.0672892
once talking repair local area done work local female home commented mess,Tottenham,sexism,2022-12-18 16:22:55+00:00,51.5976955,-0.0672892
Google MILF,Walthamstow,sexism,2022-12-18 11:20:55+00:00,51.5844701,-0.0188186
backs Michael Anthony Ramsay should executed Probably dumb fuck white gyals down with demon possessed niggers shot unno dead inna mouth,Ilford,racism,2022-12-18 01:54:12+00:00,51.5582734,0.0711669
Nuff said Bless Cunts,Ilford,sexism,2022-12-18 01:15:04+00:00,51.5582734,0.0711669
keep seeing these posts cunt talking about miracle daughter hope they very slow painful death Murderous Lowlife Cunts,Ilford,sexism,2022-12-18 01:00:03+00:00,51.5582734,0.0711669
They really dictionary definition king useless,Tottenham,disability,2022-12-17 12:46:19+00:00,51.5976955,-0.0672892
Israel Genocidal Apartheid racist country,Stratford,religion,2022-12-16 23:23:19+00:00,51.541289,-0.0035472
Lulu Putting these voice cunts shame,Tottenham,sexism,2022-12-16 20:45:20+00:00,51.5976955,-0.0672892
Fuck spotty twat,Tottenham,sexism,2022-12-16 19:58:35+00:00,51.5976955,-0.0672892
chloe just piss fucking face URGHHHH,Tottenham,sexism,2022-12-16 19:56:10+00:00,51.5976955,-0.0672892
people frigging stupid,Walthamstow,disability,2022-12-16 14:18:20+00:00,51.5844701,-0.0188186
Anything sweep China land grab under carpet,Tottenham,racism,2022-12-16 13:38:10+00:00,51.5976955,-0.0672892
course damn series canceled salute pansexual sardonic king,Tottenham,sexual_orientation,2022-12-16 00:44:15+00:00,51.5976955,-0.0672892
These cunts belong,Stratford,sexism,2022-12-15 23:47:05+00:00,51.541289,-0.0035472
give excuse just dumb empty barrel,Walthamstow,disability,2022-12-15 22:43:56+00:00,51.5844701,-0.0188186
worry yourselves Jehovah Gibbors sends forth Waring Angels Fight Take care cause Death will visiting real soon Best Wishes Satanic Ritual Mongers crime,Ilford,religion,2022-12-15 20:41:50+00:00,51.5582734,0.0711669
cause said will take away from EVER that your pipe Sacrificial Satanists Smoke more than your maddest woman block death ANYTHING EVEN bomb,Ilford,religion,2022-12-15 19:34:20+00:00,51.5582734,0.0711669
Please tell wife,Tottenham,sexism,2022-12-15 16:36:04+00:00,51.5976955,-0.0672892
Bruh Females even care anyone Just sleeping with anyone,Stratford,sexism,2022-12-15 10:21:01+00:00,51.541289,-0.0035472
Cats cunt,Ilford,sexism,2022-12-15 09:36:18+00:00,51.5582734,0.0711669
work boys school Trust this thing Unfortunately more likely listened than female teacher,Walthamstow,sexism,2022-12-14 19:02:09+00:00,51.5844701,-0.0188186
Denis stupid fellow,Walthamstow,disability,2022-12-14 14:56:21+00:00,51.5844701,-0.0188186
Your year shall well every satanic agenda thwarted Jesus name,Tottenham,religion,2022-12-14 10:14:20+00:00,51.5976955,-0.0672892
twat,Ilford,sexism,2022-12-13 22:17:52+00:00,51.5582734,0.0711669
road management through your council dolt,Tottenham,disability,2022-12-13 18:16:23+00:00,51.5976955,-0.0672892
criminals should orison Putin Lavrov regime next,Tottenham,racism,2022-12-13 16:53:17+00:00,51.5976955,-0.0672892
Russia terrorist gangster state stain humanity proud helping Ukraine defend itself againt your evil,Tottenham,racism,2022-12-13 16:40:53+00:00,51.5976955,-0.0672892
What cunt,Stratford,sexism,2022-12-13 14:24:42+00:00,51.541289,-0.0035472
Fear women,Ilford,sexism,2022-12-12 22:54:15+00:00,51.5582734,0.0711669
Most normal would know they woman,Tottenham,sexism,2022-12-12 20:53:46+00:00,51.5976955,-0.0672892
know that religious dummies that they spew their bile lewd baser sorts actually think they harm swear there many murderous imposters church beyond Hell going them Acts,Ilford,religion,2022-12-12 20:49:43+00:00,51.5582734,0.0711669
feel like women would good,Tottenham,sexism,2022-12-12 18:50:44+00:00,51.5976955,-0.0672892
everyone alive today ancestors linked slavery speak your racist self friend,Stratford,racism,2022-12-12 10:56:23+00:00,51.541289,-0.0035472
useless idiot quotes pointless idiot using cliche useful idiots,Ilford,disability,2022-12-12 10:23:20+00:00,51.5582734,0.0711669
Just tell them away human Christ died even care,Ilford,religion,2022-12-11 22:37:28+00:00,51.5582734,0.0711669
daughter played Premier League standard women football below,Ilford,sexism,2022-12-11 14:33:30+00:00,51.5582734,0.0711669
shut stupid idiot,Ilford,disability,2022-12-11 10:22:15+00:00,51.5582734,0.0711669
This twat,Ilford,sexism,2022-12-11 10:22:10+00:00,51.5582734,0.0711669
want reassure Trump still cunt,Ilford,sexism,2022-12-10 22:43:53+00:00,51.5582734,0.0711669
Women below certain wage bracket technically livestock,Stratford,sexism,2022-12-10 21:04:31+00:00,51.541289,-0.0035472
everyone right illiterate Genuine question,Tottenham,disability,2022-12-10 17:50:12+00:00,51.5976955,-0.0672892
fucking faceless twat,Tottenham,sexism,2022-12-10 17:41:58+00:00,51.5976955,-0.0672892
sound uneducated entitled haven watched documentary pass judgement moronically then went ahead make judgement others Foolish idiotic looking this,Tottenham,disability,2022-12-10 17:05:46+00:00,51.5976955,-0.0672892
HAHAHAHAHAHAHA jive turkey cunt,Tottenham,sexism,2022-12-10 16:57:58+00:00,51.5976955,-0.0672892
whole shitstorm around proof people have subscribed anaesthetised politicised emotionally retarded world which showing your true self having personality opinions capital,Stratford,disability,2022-12-10 08:19:27+00:00,51.541289,-0.0035472
talk daft father shelled fistfuls both them,Ilford,disability,2022-12-10 05:34:01+00:00,51.5582734,0.0711669
dont like female stormie,Ilford,sexism,2022-12-10 00:07:27+00:00,51.5582734,0.0711669
miserable cunt like that like,Ilford,sexism,2022-12-09 22:40:40+00:00,51.5582734,0.0711669
Daughters always left side your chest differently,Ilford,sexism,2022-12-09 13:42:49+00:00,51.5582734,0.0711669
have paid worthless insignificant pathetic worm DESERVE EVERYTHING worm deserve shit FUCK FUCK faggot,Tottenham,sexual_orientation,2022-12-09 12:24:45+00:00,51.5976955,-0.0672892
call week generous definitely worth risking life limb muppet,Tottenham,disability,2022-12-08 19:45:55+00:00,51.5976955,-0.0672892
Manipulated WOMAN EASY NEVER THAT,Walthamstow,sexism,2022-12-08 13:04:11+00:00,51.5844701,-0.0188186
actually followed read stuff would utter integrity loves theatre bigot think helps think going awash with money handing Arts,Stratford,disability,2022-12-08 02:08:20+00:00,51.541289,-0.0035472
Only women their socks last,Walthamstow,sexism,2022-12-07 22:01:52+00:00,51.5844701,-0.0188186
Then bitch,Walthamstow,sexism,2022-12-07 10:43:51+00:00,51.5844701,-0.0188186
government cannot money ignorant,Ilford,disability,2022-12-06 23:31:45+00:00,51.5582734,0.0711669
Thank project people said idiot,Stratford,disability,2022-12-06 22:52:49+00:00,51.541289,-0.0035472
Depends doesn know whether male female young where from twitter would explode with criticism know must like monitoring tweets blame,Tottenham,sexism,2022-12-06 13:27:46+00:00,51.5976955,-0.0672892
According Muppets Corner this lady hospitality industry should sell stack shelves,Walthamstow,sexism,2022-12-06 10:32:28+00:00,51.5844701,-0.0188186
What this with Muslim condemn these sorts back look your roots past years Christian killed millions Iraq Syria Libya Afghanistan,Stratford,religion,2022-12-06 07:51:07+00:00,51.541289,-0.0035472
Mucker Fuckers hell with them SAVE except they humble themselves like TRUE grateful forgiven believers,Ilford,religion,2022-12-05 20:08:53+00:00,51.5582734,0.0711669
slow Fucking cheeky cunt swear going back EVERY vast Inspiring Motivating artistic work business have into over these past years hell disrespect sister never been given Faggot,Ilford,sexual_orientation,2022-12-05 19:55:03+00:00,51.5582734,0.0711669
only funny insightful intelligent,Ilford,disability,2022-12-05 17:41:01+00:00,51.5582734,0.0711669
publicly insults twats,Ilford,sexism,2022-12-05 16:44:14+00:00,51.5582734,0.0711669
being twat,Ilford,sexism,2022-12-04 20:26:09+00:00,51.5582734,0.0711669
