Tweet,Borough,Hate Prediction,Tweet Date,Latitude,Longitude
given better score cunt give another free kick,Barnet,sexism,2022-12-10 20:12:41+00:00,51.65309,-0.2002261
Fuck this Cunt,Richmond,sexism,2022-12-10 19:53:15+00:00,51.4613531,-0.3032767
refs clearly Frenchman,London,disability,2022-12-10 19:51:17+00:00,51.5073359,-0.12765
absolute cunt given anything night,Hackney,sexism,2022-12-10 19:50:56+00:00,51.5432402,-0.0493621
cunt,Poplar,sexism,2022-12-10 19:32:09+00:00,51.5110713,-0.0144629
These French dirty bastards,Richmond,racism,2022-12-10 19:19:12+00:00,51.4613531,-0.3032767
these cunts dont back back,Romford,sexism,2022-12-10 19:18:28+00:00,51.5760462,0.1822646
Fucking come boys beat these French bastards coming home,Croydon,racism,2022-12-10 18:54:33+00:00,51.3713049,-0.101957
Come walks smash that cunt,London,sexism,2022-12-10 18:29:37+00:00,51.5073359,-0.12765
Thanks finish these bean eaters,London,racism,2022-12-10 18:29:10+00:00,51.5073359,-0.12765
leave clueless,Camden Town,disability,2022-12-10 18:04:56+00:00,51.5423045,-0.1395604
This says just used word retard irony,Camberwell,disability,2022-12-10 17:56:22+00:00,51.4745706,-0.0925416
what need mention colour shit brains,Romford,disability,2022-12-10 17:27:31+00:00,51.5760462,0.1822646
quiet Leave woman alone,Bexley,sexism,2022-12-10 17:22:02+00:00,51.4416793,0.150488
male dinosaur pundits interrupting females Typical,London,sexism,2022-12-10 17:16:34+00:00,51.5073359,-0.12765
Always frustrating with that northern prick,Camberwell,racism,2022-12-10 17:09:51+00:00,51.4745706,-0.0925416
Sadly Hanif only criminal imposed illegitimate Noon league packed with uneducated shit brain Gullu Butts,Hillingdon,religion,2022-12-10 17:00:41+00:00,51.542519299999995,-0.44833493117949663
Scums These aren real Jews these evil monsters deployed Zionists Surely these monsters have mothers they raise these animals destroy ppls livelihoods think,Brent,religion,2022-12-10 16:19:06+00:00,51.5639957,-0.27590641378489267
Women like just feel embarrassed your antics,Camden Town,sexism,2022-12-10 15:29:34+00:00,51.5423045,-0.1395604
Women have Spidey Senses their,Kingston upon Thames,sexism,2022-12-10 15:12:57+00:00,51.4096275,-0.3062621
will make crass touch comment about females,Islington,sexism,2022-12-10 14:46:57+00:00,51.5384287,-0.0999051
this context looks like right cunt watched full taking piss ignorance truth stop hating,London,sexism,2022-12-10 14:46:28+00:00,51.5073359,-0.12765
What bunch satanic weirdos Thank lord never visit such sorry bunch called human beings delusional empire,Brent,religion,2022-12-10 13:50:37+00:00,51.5639957,-0.27590641378489267
contrary began insults slurs moment were pressed argument woman should able want share changing room with that person because male proposals would make such statement impossible,Enfield,sexism,2022-12-10 13:42:08+00:00,51.6520851,-0.0810175
Sometimes hate being girl weird flirting with calling being indecisive about hair colour want TIYADDD,Camden Town,sexism,2022-12-10 12:44:34+00:00,51.5423045,-0.1395604
What midland banker both rude ignorant,Lewisham,disability,2022-12-10 12:23:17+00:00,51.4624292,-0.0101787
Women hands,Richmond,sexism,2022-12-10 11:54:48+00:00,51.4613531,-0.3032767
Women spoil Well some,Lambeth,sexism,2022-12-10 11:26:36+00:00,51.4952111,-0.1163354
This women irritates,Camden Town,sexism,2022-12-10 11:18:22+00:00,51.5423045,-0.1395604
brain dangerous fool,Barnet,disability,2022-12-10 09:28:34+00:00,51.65309,-0.2002261
allowed congress looks like retard most probably,Ealing,disability,2022-12-10 01:56:19+00:00,51.5126553,-0.3051952
think recoding audio here drag idiots will thing,Islington,disability,2022-12-10 00:15:32+00:00,51.5384287,-0.0999051
bitches,Lambeth,sexism,2022-12-09 22:41:49+00:00,51.4952111,-0.1163354
shoe doesn fuckin idiot,Bromley,disability,2022-12-09 22:06:48+00:00,51.4028046,0.0148142
Sorry support zionists,Kensington,religion,2022-12-09 21:57:35+00:00,51.4989948,-0.1991229
stupid stupid,Romford,disability,2022-12-09 21:28:32+00:00,51.5760462,0.1822646
Fuck minging cunt,Barnet,sexism,2022-12-09 21:16:47+00:00,51.65309,-0.2002261
thought running back Either absolutely stupid,Bromley,disability,2022-12-09 21:09:48+00:00,51.4028046,0.0148142
Otamendi such cunt,Romford,sexism,2022-12-09 21:08:08+00:00,51.5760462,0.1822646
mean deserves useless absolutely rubbish shouldn reffing school game,Barnet,disability,2022-12-09 20:52:38+00:00,51.65309,-0.2002261
favour unfollow pointless idiot,Wandsworth,disability,2022-12-09 19:51:31+00:00,51.4570271,-0.1932607
That what dancing around like twats,Wandsworth,sexism,2022-12-09 19:15:21+00:00,51.4570271,-0.1932607
have play team with woman said Boris firmly,Islington,sexism,2022-12-09 19:08:55+00:00,51.5384287,-0.0999051
Ever considered sleeping with your wife Wild know,Harrow,sexism,2022-12-09 17:42:42+00:00,51.596827149999996,-0.3373046180437286
deflection peasant,Camden Town,disability,2022-12-09 17:39:36+00:00,51.5423045,-0.1395604
Lord save from Gliberals most profoundly misguided people planet,Camberwell,religion,2022-12-09 17:24:33+00:00,51.4745706,-0.0925416
Cats always helpful,Harrow,sexism,2022-12-09 17:05:18+00:00,51.596827149999996,-0.3373046180437286
Australia women cricket team best team world gender sport right,Wandsworth,sexism,2022-12-09 17:02:35+00:00,51.4570271,-0.1932607
right that abomination screen sinking feeling Twat,Kingston upon Thames,sexism,2022-12-09 16:24:08+00:00,51.4096275,-0.3062621
fucking retard,Hackney,disability,2022-12-09 15:08:56+00:00,51.5432402,-0.0493621
getting what presume brasses robots last month getting bored them,London,disability,2022-12-09 13:31:19+00:00,51.5073359,-0.12765
cunt prronunce well some words Fort example espiderman,Poplar,sexism,2022-12-09 12:30:00+00:00,51.5110713,-0.0144629
just retard,Ealing,disability,2022-12-09 12:27:45+00:00,51.5126553,-0.3051952
lack melanin sending defo gentrified,Harrow,disability,2022-12-09 11:41:19+00:00,51.596827149999996,-0.3373046180437286
Yeah know long they keep goats captive cave cheese great,Bexley,racism,2022-12-09 11:21:00+00:00,51.4416793,0.150488
will give them sweets after supper being good children tell them naughty step being self cantered tone deaf immature,Hammersmith,disability,2022-12-09 11:08:35+00:00,51.4920377,-0.2236401
England obviously idiot,Romford,disability,2022-12-09 10:59:46+00:00,51.5760462,0.1822646
just dummy trebly clever explains only good play,Islington,disability,2022-12-09 10:20:04+00:00,51.5384287,-0.0999051
need better marketing twits,Islington,sexism,2022-12-09 09:30:32+00:00,51.5384287,-0.0999051
That reason women live longer,Islington,sexism,2022-12-09 09:01:19+00:00,51.5384287,-0.0999051
would better blind wouldn able read screen,Barnet,disability,2022-12-09 07:40:44+00:00,51.65309,-0.2002261
really understand what saying Feels like women,Hounslow,sexism,2022-12-09 07:37:36+00:00,51.4686132,-0.3613471
laughing herself idiot,Camden Town,disability,2022-12-09 07:32:52+00:00,51.5423045,-0.1395604
What class cunt,Kensington,sexism,2022-12-09 07:10:23+00:00,51.4989948,-0.1991229
twat husband supporting,Bexley,sexism,2022-12-09 05:29:35+00:00,51.4416793,0.150488
Works only those twat They both ridiculous,Bexley,sexism,2022-12-09 05:08:47+00:00,51.4416793,0.150488
Mocking queen Twat,Bexley,sexism,2022-12-09 05:07:09+00:00,51.4416793,0.150488
dripless little cunt,Hackney,sexism,2022-12-09 01:58:34+00:00,51.5432402,-0.0493621
literally soooooooooooooo fucking stupid,Camden Town,disability,2022-12-09 01:02:10+00:00,51.5423045,-0.1395604
Would more useful show women laid percentage total workforce rather than female male workforce,Camden Town,sexism,2022-12-09 00:29:01+00:00,51.5423045,-0.1395604
words needed aside most important phrase DESERVE EVERYTHING weak fuck deserve shit Hahaha,London,sexism,2022-12-08 23:28:16+00:00,51.5073359,-0.12765
LMAO some bitches never learn their lesson,Camden Town,sexism,2022-12-08 23:28:05+00:00,51.5423045,-0.1395604
What nasty snivelling shit Women have penis,Camden Town,sexism,2022-12-08 23:04:35+00:00,51.5423045,-0.1395604
Priority probably canestan annoying cunt,Poplar,sexism,2022-12-08 22:34:04+00:00,51.5110713,-0.0144629
Megan mocking Royal real from attention seeking twat,Hillingdon,sexism,2022-12-08 21:57:06+00:00,51.542519299999995,-0.44833493117949663
Apparently only LOOK like idiot,Wandsworth,disability,2022-12-08 21:18:11+00:00,51.4570271,-0.1932607
idiot probably spell,Wandsworth,disability,2022-12-08 21:02:04+00:00,51.4570271,-0.1932607
scales weigh lightest have over year brain look absolutely gigantic,Islington,disability,2022-12-08 20:39:39+00:00,51.5384287,-0.0999051
girls with mostly fire their natal chart lots placements masculine Yang energy absolutely shat sick,Lambeth,sexism,2022-12-08 20:32:06+00:00,51.4952111,-0.1163354
concerned about Pakistan going down tube retarded Lifafay Lifafyan when watching audio video pornography circling around crap Tosha Khana,Hillingdon,disability,2022-12-08 19:56:57+00:00,51.542519299999995,-0.44833493117949663
concerned about Pakistan going down tube retarded Lifafay Lifafyan when watching audio video pornography circling around crap Tosha Khana,Hillingdon,disability,2022-12-08 19:17:43+00:00,51.542519299999995,-0.44833493117949663
concerned about Pakistan going down tube retarded Lifafay Lifafyan when watching audio video pornography circling around crap Tosha Khana,Hillingdon,disability,2022-12-08 19:14:37+00:00,51.542519299999995,-0.44833493117949663
concerned about Pakistan going down tube retarded Lifafay Lifafyan when watching pornography audio video they circling around crap Tosha Khana,Hillingdon,disability,2022-12-08 19:06:24+00:00,51.542519299999995,-0.44833493117949663
really aren well interested truth walked through check yourself done with anyone incapable adult discussion,Ealing,disability,2022-12-08 18:57:45+00:00,51.5126553,-0.3051952
concerned about Pakistan going down tube retarded Lifafay Lifafyan still circumnavigating around crap Tosha Khana,Hillingdon,disability,2022-12-08 18:41:49+00:00,51.542519299999995,-0.44833493117949663
other words fvckn women,Greenwich,sexism,2022-12-08 18:35:44+00:00,51.4820845,-0.0045417
French delusional,Islington,disability,2022-12-08 17:37:10+00:00,51.5384287,-0.0999051
full druggys workers creepy perverts shops issues with shop weirdo there,London,sexual_orientation,2022-12-08 17:22:42+00:00,51.5073359,-0.12765
years Jesus Christ Professional idiot,Kingston upon Thames,disability,2022-12-08 17:19:41+00:00,51.4096275,-0.3062621
Twat,Camberwell,sexism,2022-12-08 16:42:39+00:00,51.4745706,-0.0925416
thinks amusing acting stupidity knows bounds,Camberwell,disability,2022-12-08 16:13:27+00:00,51.4745706,-0.0925416
words explain depraved zionists,Kingston upon Thames,religion,2022-12-08 15:19:01+00:00,51.4096275,-0.3062621
news Conservatives idiot alright,Bexley,disability,2022-12-08 15:11:53+00:00,51.4416793,0.150488
Disrespectfully fuck yourselves lady,Islington,sexism,2022-12-08 15:11:16+00:00,51.5384287,-0.0999051
also recall waved concerns China ramped persecution Uighurs facto guardian Islam holiest sites effectively gave China green light pursue campaign savage repression against Muslims with added venom,Islington,racism,2022-12-08 14:50:37+00:00,51.5384287,-0.0999051
cold Demonic mean just anyone this Bloody barbaric savages,Bexley,religion,2022-12-08 14:30:42+00:00,51.4416793,0.150488
watch Both twat,Greenwich,sexism,2022-12-08 11:55:37+00:00,51.4820845,-0.0045417
real level actually think ready gonna make 2023 bitch dumb,Croydon,sexism,2022-12-08 11:17:14+00:00,51.3713049,-0.101957
Some people worship objects other than Allah believe three gods what such people called Such people called Kafirs unbelievers Mushriks Polytheisists,Harrow,religion,2022-12-08 11:05:31+00:00,51.596827149999996,-0.3373046180437286
They Zealots Horrible lots,Camberwell,religion,2022-12-08 10:27:36+00:00,51.4745706,-0.0925416
Told wouldn cheap bald cunt,Islington,sexism,2022-12-08 10:14:45+00:00,51.5384287,-0.0999051
retard,Camberwell,disability,2022-12-08 10:06:45+00:00,51.4745706,-0.0925416
says fake profile idolizing delusional lying cunt complete failure shit Just like your precious bitch delusional should life Urgently,Poplar,sexism,2022-12-08 10:01:51+00:00,51.5110713,-0.0144629
have cunt,Wandsworth,sexism,2022-12-08 07:54:51+00:00,51.4570271,-0.1932607
glad blocked moron,City of London,disability,2022-12-08 07:10:03+00:00,51.5156177,-0.0919983
matter kill last last idiot,Hillingdon,disability,2022-12-08 06:43:06+00:00,51.542519299999995,-0.44833493117949663
liar actually eyes when going around outside instead wearing rose tinted cycling goggles cycle lane should removed under used thanks muting saves doing what idiot,Wandsworth,disability,2022-12-08 04:23:34+00:00,51.4570271,-0.1932607
this wins again means literally full incompetent retarded people senile trust someone like this handle nuclear weapons literally influence billions,Ealing,disability,2022-12-08 02:39:21+00:00,51.5126553,-0.3051952
Will punch woman that hard,Bromley,sexism,2022-12-08 00:41:55+00:00,51.4028046,0.0148142
guys this woman work building come floor like ewww guys hotdesk like well only come days week that starts BRAGGING fact goes into office days week BRAGGING,Camberwell,sexism,2022-12-07 22:24:32+00:00,51.4745706,-0.0925416
Tone deaf,Greenwich,disability,2022-12-07 22:00:59+00:00,51.4820845,-0.0045417
real idiot,Camberwell,disability,2022-12-07 20:45:57+00:00,51.4745706,-0.0925416
people dumb something,Islington,disability,2022-12-07 20:15:21+00:00,51.5384287,-0.0999051
thinking they know better than women really should used,Barnet,sexism,2022-12-07 19:08:35+00:00,51.65309,-0.2002261
Deffo watching videos absolute cunt insulted reason,Sutton,sexism,2022-12-07 19:07:47+00:00,51.357464449999995,-0.17362689496950337
NORFOLK WRAP reviews action from women game county including action girls midweek game,Kingston upon Thames,sexism,2022-12-07 17:50:36+00:00,51.4096275,-0.3062621
Well said when going female only UEFA,Bromley,sexism,2022-12-07 17:42:50+00:00,51.4028046,0.0148142
From perspective most women look pretty good,Barnet,sexism,2022-12-07 16:33:13+00:00,51.65309,-0.2002261
Some twat parking with this sticker Catford Feels like asking,Lewisham,sexism,2022-12-07 15:37:44+00:00,51.4624292,-0.0101787
Women will literally different therapists before will consider applying point that them agree upon,Hillingdon,sexism,2022-12-07 15:12:37+00:00,51.542519299999995,-0.44833493117949663
thinks smart emasculated Ronald referring everything does stupid shows respect wants tell everything then calls child would drive lose,Richmond,disability,2022-12-07 15:03:21+00:00,51.4613531,-0.3032767
corrupt greedy entitled woman,Camden Town,sexism,2022-12-07 13:59:21+00:00,51.5423045,-0.1395604
channelled inner Karen threw kitchen sink tried help from feminists people convo,Camden Town,sexism,2022-12-07 09:38:54+00:00,51.5423045,-0.1395604
think women well,Paddington,sexism,2022-12-07 09:36:37+00:00,51.5154795,-0.175365
stinky food public transport cunt,Wandsworth,sexism,2022-12-07 08:53:50+00:00,51.4570271,-0.1932607
criticised because female pundit mens game because very mistake When place yourself highest stage such World then must prepared face criticism,Enfield,sexism,2022-12-07 06:56:17+00:00,51.6520851,-0.0810175
China absurd massacre about millions surprising history repeating itself Russia causing wars china care kill masses,Islington,racism,2022-12-07 06:44:21+00:00,51.5384287,-0.0999051
please send china,Camden Town,racism,2022-12-07 06:33:14+00:00,51.5423045,-0.1395604
baddest bitch ever laid eyes,London,sexism,2022-12-07 00:01:39+00:00,51.5073359,-0.12765
Does still Dong Through which means does reaches climax will attracted male female something else goes prison going male prison shows bits female toilet committed offence,Poplar,sexism,2022-12-06 23:45:35+00:00,51.5110713,-0.0144629
girl really tooth poor table manners from becoming your worst nightmare,Barnet,sexism,2022-12-06 22:22:14+00:00,51.65309,-0.2002261
lack intelligence charm empathy long British media,Camden Town,disability,2022-12-06 22:16:26+00:00,51.5423045,-0.1395604
Stadium stadium chinning cunt,Hackney,sexism,2022-12-06 21:31:40+00:00,51.5432402,-0.0493621
dont understand political lesbian really thing,Camden Town,sexism,2022-12-06 20:52:12+00:00,51.5423045,-0.1395604
your religion criminalise imprison torture murder people Bigotry brutality against your fellow human brothers sisters horrendous whether base your religion,Lambeth,religion,2022-12-06 20:50:03+00:00,51.4952111,-0.1163354
real Coke snorting dyke going embarrass Scots,Ealing,sexual_orientation,2022-12-06 19:31:26+00:00,51.5126553,-0.3051952
gender expanding male authors earning typically more than their female peers,Camberwell,sexism,2022-12-06 19:17:57+00:00,51.4745706,-0.0925416
cares ignorant oink Language matters,Hillingdon,disability,2022-12-06 18:50:12+00:00,51.542519299999995,-0.44833493117949663
massive cunt have make sure keep other side scale topped adding much value they with your toxic shit Ronaldo value dipping catastrophically doubling down being massive cunt worst time possible,Poplar,sexism,2022-12-06 18:47:32+00:00,51.5110713,-0.0144629
course picks useless player like play,Barnet,disability,2022-12-06 18:40:10+00:00,51.65309,-0.2002261
male friends really remind much dogs,Camberwell,sexism,2022-12-06 18:19:58+00:00,51.4745706,-0.0925416
Another patriarchal Abrahamic cult inflicting their mumbo jumbo restrictions those cult free Islam Christianity Judaism they misogynistic homophobic freedom trashing insane made controlling destructive organisations,Camberwell,religion,2022-12-06 18:07:27+00:00,51.4745706,-0.0925416
compared race footballer gorilla,Kingston upon Thames,disability,2022-12-06 16:04:05+00:00,51.4096275,-0.3062621
bjork doesn rhyme with cunt,Paddington,sexism,2022-12-06 14:00:28+00:00,51.5154795,-0.175365
Girls hate they annoying,Hillingdon,sexism,2022-12-06 14:00:07+00:00,51.542519299999995,-0.44833493117949663
wanna personal with Have balls bark just pussy covered with Dollars Here Name Mohammed AJAIB come sick hyenas,Brent,religion,2022-12-06 13:37:58+00:00,51.5639957,-0.27590641378489267
Dickheds that They rather sell their mothers dollars more,Brent,sexism,2022-12-06 12:46:16+00:00,51.5639957,-0.27590641378489267
used Quizlamic Fundamentalists,Camden Town,religion,2022-12-06 11:31:10+00:00,51.5423045,-0.1395604
exactly silly bint,Romford,disability,2022-12-06 10:35:04+00:00,51.5760462,0.1822646
need someone inside their information against Wouldn offer cost untrustworthy female,Camberwell,sexism,2022-12-06 10:07:52+00:00,51.4745706,-0.0925416
First define woman,Camden Town,sexism,2022-12-06 10:07:30+00:00,51.5423045,-0.1395604
Women carry same level sometimes that fair look environments sales worked they their worst when male dominated,London,sexism,2022-12-06 09:34:44+00:00,51.5073359,-0.12765
woman racist,Romford,sexism,2022-12-06 08:49:31+00:00,51.5760462,0.1822646
Will believe when they recommend their mothers daughters,Lewisham,sexism,2022-12-06 07:55:06+00:00,51.4624292,-0.0101787
just wanna housewife career,Ealing,sexism,2022-12-06 07:20:24+00:00,51.5126553,-0.3051952
This patently nonsense Have sinned because pork drink alcohol beef because Muslim Hindu definition atheists without believe members religion,Enfield,religion,2022-12-06 06:58:46+00:00,51.6520851,-0.0810175
Training legs makes realise surgery popular with girls,London,sexism,2022-12-06 06:26:40+00:00,51.5073359,-0.12765
Depends description also given Muslims mullahs impossible Satan much more closer heart,Kingston upon Thames,religion,2022-12-06 05:19:18+00:00,51.4096275,-0.3062621
Horrific torture dogs China They culture that excuse horrendous cruelty dogs such wonderful animals tortured slaughtered vicious gangsters,Hillingdon,racism,2022-12-06 03:11:00+00:00,51.542519299999995,-0.44833493117949663
Putin terrorist world,Hammersmith,racism,2022-12-05 22:50:47+00:00,51.4920377,-0.2236401
been slaughtering female commentators recently then today listened Jermaine Jenas honest just woman ever heard,Camberwell,sexism,2022-12-05 21:31:58+00:00,51.4745706,-0.0925416
Will probably regret asking blonde woman,Richmond,sexism,2022-12-05 21:07:23+00:00,51.4613531,-0.3032767
Woman Gives Birth Years Then Doctors Make Shocking Discovery,Romford,sexism,2022-12-05 20:41:43+00:00,51.5760462,0.1822646
Woman prepares have corpse dissected live television world first,Romford,sexism,2022-12-05 19:55:14+00:00,51.5760462,0.1822646
This what channelling next time anyone challenges resting bitch face,Richmond,sexism,2022-12-05 19:29:58+00:00,51.4613531,-0.3032767
yeah totally agree sene which unrealistic player many market stupid,Brent,disability,2022-12-05 18:51:42+00:00,51.5639957,-0.27590641378489267
really amusing clown,Wandsworth,disability,2022-12-05 18:27:56+00:00,51.4570271,-0.1932607
twatty overconfident,Hammersmith,sexism,2022-12-05 17:41:54+00:00,51.4920377,-0.2236401
bloke seems fantastically stupid,Islington,disability,2022-12-05 17:02:28+00:00,51.5384287,-0.0999051
fuck cunt,Bexley,sexism,2022-12-05 16:55:41+00:00,51.4416793,0.150488
piece given actual brain worms think,Hackney,disability,2022-12-05 16:11:10+00:00,51.5432402,-0.0493621
Fuck Barbarians They worse than animals,London,religion,2022-12-05 13:29:34+00:00,51.5073359,-0.12765
everyone else table shook hate niggas that stand nothing,Hounslow,racism,2022-12-05 11:18:43+00:00,51.4686132,-0.3613471
Full smol bean mode lmao Ablu ablu ablu nasty homosexuals told fuck when said that they should prison,Camden Town,religion,2022-12-05 11:15:45+00:00,51.5423045,-0.1395604
just doing were cunt Nice,Lambeth,sexism,2022-12-05 03:52:55+00:00,51.4952111,-0.1163354
Girls dying grab attention tweeting shitty things over social media,Brent,sexism,2022-12-05 00:43:46+00:00,51.5639957,-0.27590641378489267
fucking bitches,London,sexism,2022-12-05 00:22:25+00:00,51.5073359,-0.12765
Thought were recreating female version hobbit,Bexley,sexism,2022-12-04 23:07:34+00:00,51.4416793,0.150488
Some women hilarious,Lambeth,sexism,2022-12-04 22:57:39+00:00,51.4952111,-0.1163354
having funniest convo with this girl apparently rude because wouldn open door woman wife told hands open,Lambeth,sexism,2022-12-04 22:57:08+00:00,51.4952111,-0.1163354
become proper twat innit,Richmond,sexism,2022-12-04 22:44:42+00:00,51.4613531,-0.3032767
Grow cunt,Romford,sexism,2022-12-04 22:40:12+00:00,51.5760462,0.1822646
tell these niggas dumb fuck,Brent,racism,2022-12-04 21:30:56+00:00,51.5639957,-0.27590641378489267
hate Rwandan peoples hate Kagame killer exterminer,Romford,racism,2022-12-04 20:15:55+00:00,51.5760462,0.1822646
What female gaze make sure never ever,Camberwell,sexism,2022-12-04 19:52:44+00:00,51.4745706,-0.0925416
Hahaha quickly delete silly cunt,Bromley,sexism,2022-12-04 19:48:38+00:00,51.4028046,0.0148142
twat,Ealing,sexism,2022-12-04 19:33:00+00:00,51.5126553,-0.3051952
Utterly awful cunts,Kensington,sexism,2022-12-04 19:31:52+00:00,51.4989948,-0.1991229
what work live what free cottage idiot,Harrow,disability,2022-12-04 19:27:08+00:00,51.596827149999996,-0.3373046180437286
never respect cunts,Brent,sexism,2022-12-04 19:11:37+00:00,51.5639957,-0.27590641378489267
Asking girl about trading strategy first date ideal breaker,Paddington,sexism,2022-12-04 18:31:06+00:00,51.5154795,-0.175365
twat fuck back your daily heil newsroom,Lewisham,sexism,2022-12-04 17:53:48+00:00,51.4624292,-0.0101787
just twat trying some limelight,London,sexism,2022-12-04 17:01:12+00:00,51.5073359,-0.12765
Just smash dickhead,Camberwell,sexual_orientation,2022-12-04 16:55:55+00:00,51.4745706,-0.0925416
Well rude twat aren proud,Lambeth,sexism,2022-12-04 16:54:15+00:00,51.4952111,-0.1163354
Fuck master Harry draining fucking hard Bitch,Richmond,sexism,2022-12-04 15:51:16+00:00,51.4613531,-0.3032767
least offensive possible HATE women commentary game just doesn right with,Sutton,sexism,2022-12-04 15:38:42+00:00,51.357464449999995,-0.17362689496950337
like females,London,sexism,2022-12-04 15:16:29+00:00,51.5073359,-0.12765
bitches,Brent,sexism,2022-12-04 15:02:27+00:00,51.5639957,-0.27590641378489267
think question dislike women,Camberwell,sexism,2022-12-04 15:00:00+00:00,51.4745706,-0.0925416
Cats crazy creatures,Brent,sexism,2022-12-04 14:59:38+00:00,51.5639957,-0.27590641378489267
Female commentator AGAIN KNOCKOUT STAGES taking piss,Paddington,sexism,2022-12-04 14:58:05+00:00,51.5154795,-0.175365
Thanks when come chop femi money,Barking,sexism,2022-12-04 14:57:12+00:00,51.5389922,0.0804245
pathetic faggot purpose this Earth that SERVE MAKE HAPPY freaking then subscribe,London,sexual_orientation,2022-12-04 14:53:46+00:00,51.5073359,-0.12765
know story heaven sake read tweet husband rightfully tired after work look after kids house woman doing happily otherwise this tweet mate would needed lady,London,sexism,2022-12-04 14:46:24+00:00,51.5073359,-0.12765
Fuck master master Olly turns into Bitch easily especially when compression tight underwear tight gear humiliate,Richmond,sexism,2022-12-04 13:58:27+00:00,51.4613531,-0.3032767
started sending master Olly again Fuck really Bitch makes weak,Richmond,sexism,2022-12-04 13:13:49+00:00,51.4613531,-0.3032767
girls really fucked over gigs,Poplar,sexism,2022-12-04 12:38:46+00:00,51.5110713,-0.0144629
Correct running whole Islington network Please ladies,Islington,sexism,2022-12-04 12:35:43+00:00,51.5384287,-0.0999051
wish like woman church gives everyone backwards peace sign ahead communion knowing full well swearing,Poplar,sexism,2022-12-04 12:15:11+00:00,51.5110713,-0.0144629
cannot validate horrors perpetrated zionists kahanists bless Holocaust denier,Lambeth,religion,2022-12-04 11:40:09+00:00,51.4952111,-0.1163354
